{"suggest_id":"sg_abcdef12","ts":1700000005000,"symbol_set":["BTCUSDT","ETHUSDT"],"param_set":{"min_conf":0.62,"cooldown_s":90,"min_liquidity":"normal"},"valid_for":120,"evidence":{"why":["spread收窄","成交量抬升","波动率回落"],"stats":{"winrate_est":0.58},"source_window":300},"risk_annotation":{"max_emit_per_min":3,"max_daily_emit":30,"abstain_rules":{"liquidity_tag":"low"}},"hash":"abcd1234ef"}
